{"schema_version":"csg.pointer.v1","project_id":"CHATGPT_GLOBAL_SKILL_GOVERNANCE","binding_id":"CSG-GOVERNANCE-BINDING-V2","binding_generation":2,"checkpoint_seq":190,"checkpoint_path":"governance/csg/checkpoints/000190.json","checkpoint_digest":"sha256:7925c06ea87b9cd98cdd8b45fb8fe0766a99abd6cb520a76890749afce02dd2e","previous_control_oid":{"algorithm":"sha1","hex":"c764b26956c93dc308d4cebb7671a7c919e94d49"},"transition_id":"GOV-HARDENING-P5-TUNNEL-CLI-CAPABILITY-PROBE-190","reader_compatibility":{"min_schema":"csg.checkpoint.v1","max_schema":"csg.checkpoint.v1"}}